
"кевін у відповідь випромінював радше злість, ніж переляк. метт зробив крок до них, збираючись припинити другий раунд бійки.","кевін у відповідь випромінював радше злість , ніж переляк . метт Здійснив крок до них , збираючись припинити другий раунд бійки .",0.5490196078431373
"не Відводячи очей від ендрю , кевін помахом руки наказав метту не втручатися , але той проігнорував його жест . на відстані випаду бойд зупинився і заціпенів , напружено чекаючи , коли той зробить неправильний рух .","не відводячи очей від ендрю, кевін помахом руки наказав метту не втручатися, але той проігнорував його жест. на відстані випаду бойд зупинився і завмер, напружено чекаючи, коли той зробить неправильний рух.",0.7052023121387283
"після того як метт Нерухомо. завмер , ендрю знову заговорив : до чого ж ти передбачуваний і жалюгідний … хочеш пораду ? типу нагороду за старанність .","після того як метт нерухомо завмер, ендрю знову заговорив: до чого ж ти передбачуваний і жалюгідний… хочеш пораду? типу нагороду за старанність.",1.0
"готовий слухати? тобі пощастить більше, якщо проситимеш тільки те, що дійсно в змозі отримати. — я можу це отримати, — глухим від розпачу голосом видавив кевін.","готовий слухати ? тобі пощастить більше , якщо Попросиш тільки те , що дійсно в змозі отримати . — я можу це отримати , — Нечуючий від розпачу голосом видавив кевін .",0.5433070866141733
"— просто ти поводишся як ідіот. — що ж, побачимо.","— просто ти Зведешся як ідіот . — що ж , Побачимо .",0.6571428571428571
"тільки не говори потім, що я тебе не попереджав. ендрю обійшов кевіна і витер ножа об його рукав.","тільки не Кажи потім , що я тебе не попереджав . ендрю обійшов кевіна і витер ножа об його рукав .",0.8311688311688312
"хоч би який Костюм він носив , одна деталь залишалася незмінною : чорні пов'язки на передпліччях від зап'ястя до ліктя . Бродив жарт , що вони служать лише для того , щоб розрізняти близнюків , проте пов'язки мали й інше призначення .","хоч би який одяг він носив, одна деталь залишалася незмінною: чорні пов'язки на передпліччях від зап'ястя до ліктя. ходив жарт, що вони служать лише для того, щоб розрізняти близнюків, проте пов'язки мали й інше призначення.",0.4972677595628415
"на початку літа ніл дізнався, що під тонкою тканиною заховані піхви для ножів. очистивши лезо, ендрю прибрав ножа і покинув роздягальню.","на початку літа ніл дізнався , що під тонкою тканиною заховані піхви для ножів . очистивши лезо , Чорт прибрав ножа і покинув роздягальню .",0.6875
"— ти серйозно ? — роздратовано кинув кевінові переможниці , беручись за сумку . — я Мислив , що ти давно на це забив .","— ти серйозно? — роздратовано кинув кевінові нікі, беручись за сумку. — я думав, що ти давно на це забив.",0.4186046511627907
"тобі його не перебороти . не вшанувавши Перемоги відповіддю , кевін кинувся до своєї шафки й почав збирати сумку .","тобі його не переперти. не вшанувавши нікі відповіддю, кевін кинувся до своєї шафки й почав збирати сумку.",0.5760869565217391
"Перемога похитав головою і рушив до виходу . аарон , який не гаяв Доби , споглядаючи коротку сутичку , а складав речі , вийшов одразу за ним .","нікі похитав головою і рушив до виходу. аарон, який не гаяв часу, споглядаючи коротку сутичку, а складав речі, вийшов одразу за ним.",0.8899082568807339
"ніл Ждати від кевіна ще одного спалаху гніву , проте його залишки кевін випускав мовчки — заштовхував екіпірування в сумку з такою люттю , наче хотів її порвати . для кевіна дея в бутті не було нічого важливішого за ексі .","ніл чекав від кевіна ще одного спалаху гніву, проте його залишки кевін випускав мовчки — заштовхував екіпірування в сумку з такою люттю, наче хотів її порвати. для кевіна дея в житті не було нічого важливішого за ексі.",0.96045197740113
"він Зріс на цьому виді спорту і мріяв лише про те , щоб стати найкращим нападником з усіх , які коли -небудь виходили на поле . кевін Показував жорсткі вимоги до товаришів по команді , але найсуворіше ставився до себе ; не терпів непрофесіоналізму і змушував лисів викладатись по максимуму .","він виріс на цьому виді спорту і мріяв лише про те, щоб стати найкращим нападником з усіх, які коли-небудь виходили на поле. кевін пред'являв жорсткі вимоги до товаришів по команді, але найсуворіше ставився до себе; не терпів непрофесіоналізму і змушував лисів викладатись по максимуму.",0.9529914529914529
"Зокрема кевіна дратувала цілковита байдужість ендрю . за статистикою , Підлабузник вважався одним із найкращих воротарів південно - східного округу , причому не докладаючи для цього жодних зусиль .","особливо кевіна дратувала цілковита байдужість ендрю. за статистикою, міньярд вважався одним із найкращих воротарів південно-східного округу, причому не докладаючи для цього жодних зусиль.",0.5914634146341463
"кевін витратив майже рік у спробах до нього достукатися . він пристрасно хотів , щоб ендрю Зайнявся грою , хотів запалити в ньому наснагу і жадав цього так несамовито , як мрущий жадає останнього ковтка повітря .","кевін витратив майже рік у спробах до нього достукатися. він пристрасно хотів, щоб ендрю перейнявся грою, хотів запалити в ньому наснагу і жадав цього так несамовито, як мрущий жадає останнього ковтка повітря.",0.5789473684210527
"ендрю це знав , а Тож продовжував чхати на ексі . ніл розумів , чому кевін сердиться .","ендрю це знав, а тому продовжував чхати на ексі. ніл розумів, чому кевін сердиться.",0.7692307692307693
"у червні, вперше побачивши ендрю на полі, він і сам був вражений: неймовірно — та що там просто неможливо, — щоб такий обдарований гравець так спокійно закопував власний талант у землю. на жаль, ліки, які приймав ендрю, катастрофічно звужували обсяг його уваги та вводили у стан ейфорії, вбиваючи будь-який інтерес до результатів матчу.","у Черезень , вперше побачивши ендрю на полі , він і сам був вражений : неймовірно — та що там просто неможливо , — щоб такий обдарований гравець так спокійно закопував власний талант у землю . на Співчуття , ліки , які приймав ендрю , катастрофічно звужували обсяг його уваги та вводили у стан ейфорії , вбиваючи будь-який інтерес до результатів матчу .",0.4575645756457565
"Напевно , у цьому випадку пропуск таблеток перед грою міг справді розв'язати проблему , тільки ось ніл пам'ятав свою спробу поговорити з міньярдом у той момент , коли його свідомість частково прояснилася : ендрю тоді заявив , що ексі — надто нудне заняття , щоб витрачати на нього сили . Перепони у вигляді психологічних проблем та ліків багато що пояснювали , проте ендрю щойно , на очах у ніла , практично без заперечень пішов на угоду з ваймаком .","ймовірно, у цьому випадку пропуск таблеток перед грою міг справді розв'язати проблему, тільки ось ніл пам'ятав свою спробу поговорити з міньярдом у той момент, коли його свідомість частково прояснилася: ендрю тоді заявив, що ексі — надто нудне заняття, щоб витрачати на нього сили. перешкоди у вигляді психологічних проблем та ліків багато що пояснювали, проте ендрю щойно, на очах у ніла, практично без заперечень пішов на угоду з ваймаком.",0.34916201117318435
"ніл поки що не знав, що це означає і як до цього ставитися. дочекавшись, поки піде кевін, метт подивився на ніла:","Египет поки що не знав , що це означає і як до цього ставитися . Дождавшись , поки піде кевін , метт подивився на ніла :",0.4318181818181818
"— сьогоднішня гра буде ахуєнною! — ти, мабуть, хотів сказати хуйовою, — озвався той, застібаючи сумку.","— Теперішня гра буде ахуєнною ! — ти , мабуть , хотів сказати хуйовою , — озвався той , застібаючи сумку .",0.9102564102564102
"метт Мрачно посміхнувся і закрив свою шафку . проходячи повз ніщо до виходу , бойд ляснув його по плечу .","метт похмуро посміхнувся і закрив свою шафку. проходячи повз ніла до виходу, бойд ляснув його по плечу.",0.8795180722891566
"— головне — не думай про це, доки не вийдемо на поле. навряд чи тобі стане краще, якщо ти всю дорогу мучитимешся про те, чого не можеш змінити.","— Суть — не думай про це , доки не вийдемо на поле . навряд чи тобі стане Ліпше , якщо ти всю дорогу мучитимешся про те , чого не можеш змінити .",0.8990825688073395
"— метт, ти йди, а я допоможу тренеру повантажити ключки. хочу дещо його запитати.","— метт , ти Іди , а я допоможу тренеру повантажити ключки . хочу Трохи його запитати .",0.7301587301587301
"— Справді ? добре , тоді давай закину твої речі в автобус , незручно ж тягти все одразу . ніл вручив йому важку сумку та притримав двері .","— точно? добре, тоді давай закину твої речі в автобус, незручно ж тягти все одразу. ніл вручив йому важку сумку та притримав двері.",0.9333333333333333
"метт повернув ліворуч, до виходу, а ніл — праворуч, у фоє. ваймак відкрив інвентарну комору і вже викотив стійку з ключками.","метт Звернув ліворуч , до виходу , а ніл — праворуч , у фоє . Чоловік відкрив інвентарну комору і вже викотив стійку з ключками .",0.5510204081632653
"захисні чохли були відкинуті, щоб тренер міг оглянути голівки. ніл знав, що ключки в хорошому стані, тому що лиси щодня слідкували, чи вони в порядку, перед тим, як залишити стадіон, проте ваймак все одно перевірив натяг кожної сітки.","захисні чохли були відкинуті , щоб Наставник міг оглянути голівки . ніл знав , що ключки в хорошому стані , тому що лиси щодня слідкували , чи вони в порядку , перед тим , як залишити стадіон , проте ваймак все одно перевірив натяг кожної сітки .",0.8297872340425532
"піднявши очі, тренер помітив ніла, але його появу на заміну бойда не прокоментував. ніл теж промовчав і лише стиснув пальцями сітку своєї ключки.","піднявши очі , Наставник помітив ніла , але його появу на заміну бойда не прокоментував . ніл теж промовчав і лише стиснув Перстами сітку своєї ключки .",0.8319327731092437
"Тепер він брав із собою одразу дві — про всяк випадок . конструкція у них Стійка — виготовлені так , щоб передавати м'ячу енергію кидка і витримувати удари інших ключок , і все ж , якщо добре хряснути , зламатися може навіть найміцніша .","сьогодні він брав із собою одразу дві — про всяк випадок. конструкція у них міцна — виготовлені так, щоб передавати м'ячу енергію кидка і витримувати удари інших ключок, і все ж, якщо добре хряснути, зламатися може навіть найміцніша.",0.6756756756756757
"а нілу Цілком не хотілося опинитися далеко від « лисячої нори » з порожніми руками . — Візьми пальці , — попередив ваймак .","а нілу зовсім не хотілося опинитися далеко від «лисячої нори» з порожніми руками. — забери пальці, — попередив ваймак.",0.8947368421052632
ніл Відійшов і тренер опустив кришки . один за одним клацнули Полімерні гачки .,ніл відійшов і тренер опустив кришки. один за одним клацнули пластмасові гачки.,0.796875
"ваймак Дещо трусив стійку , перевіряючи , що все надійно закріплено , потім жестом велів нілу братися за неї спереду . ніл виконав Рекомендацію , але залишився на місці , так і сяк формулюючи питання .","ваймак трохи трусив стійку, перевіряючи, що все надійно закріплено, потім жестом велів нілу братися за неї спереду. ніл виконав вказівку, але залишився на місці, так і сяк формулюючи питання.",0.29559748427672955
"він боявся, що ваймак почне його квапити, оскільки часу було мало, проте тренер терпляче чекав. — не знав, що ендрю має цінник, — нарешті промовив ніл. — він не схожий на людину, яку можна купити.","він Страшився , що ваймак почне його квапити , оскільки часу було мало , проте тренер терпляче чекав . — не знав , що ендрю має цінник , — Зрештою промовив ніл . — він не схожий на людину , яку можна купити .",0.9133333333333333
"— він не продається, — відповів ваймак. — ендрю погодився б, навіть якби я попросив його зробити це безкорисливо.","— він не продається , — відповів Стерв'ятник . — Злодій погодився б , навіть якби я попросив його зробити це безкорисливо .",0.6590909090909091
"я Пообіцяв лише тому , що знаю , чого йому коштуватиме сьогоднішня гра . — але чому він погодився ? — з натиском спитав ніл . — що у вас такого особливого ?","я пообіцяв лише тому, що знаю, чого йому коштуватиме сьогоднішня гра. — але чому він погодився? — з натиском спитав ніл. — що у вас такого особливого?",1.0
"ваймак скептично вигнув брову. — може, ти помітив, як часто я заплющую очі на те, що діється в цій команді? — сказав ваймак.","Вірвак скептично вигнув брову . — Зможе , ти помітив , як часто я заплющую очі на те , що діється в цій команді ? — сказав ваймак .",0.723404255319149
"— я знаю , кого набрав , і Збагну. , що деяким із цих людей треба дати трохи волі , щоб вони трималися на плаву . доки це нікому не Зашкоджує , поки нікого не застукали й поки вам вистачає розуму не тягнути це лайно на поле , мені абсолютно по барабану , чим ви там зайняті у вільний час .","— я знаю, кого набрав, і розумію, що деяким із цих людей треба дати трохи волі, щоб вони трималися на плаву. доки це нікому не шкодить, поки нікого не застукали й поки вам вистачає розуму не тягнути це лайно на поле, мені абсолютно по барабану, чим ви там зайняті у вільний час.",0.5504587155963303
"мене це не стосується, тому що я не хочу, щоб це стосувалося мене. ваймак натякав на вечірки з наркотиками та алкоголем у колумбії, куди ендрю возив свою компанію.","мене це не стосується , Тож що я не хочу , щоб це стосувалося мене . ваймак натякав на Гулянки з наркотиками та алкоголем у колумбії , куди ендрю возив свою компанію .",0.7938931297709924
"ніл не знав, чому дивуватися більше: тому, що тренер був в курсі розваг підопічних, або тому, що він дивиться на це крізь пальці. бездіяльність ваймака не дорівнювала схваленню, проте головний тренер команди не має права заохочувати подібне навіть побічно.","ніл не знав , Чого дивуватися більше : тому , що тренер був в курсі розваг підопічних , або тому , що він дивиться на це крізь пальці . БЕЗДІЯ ваймака не дорівнювала схваленню , проте головний тренер команди не має права заохочувати подібне навіть побічно .",0.5285714285714286
"хтось вважав би девіда ваймака безвідповідальним і, можливо, мав би рацію, проте ніл розумів, що не все так просто. деякі стверджували, що ваймак набирає в команду проблемних юнаків та дівчат заради самопіару, інші бачили в ньому заблудлого ідеаліста.","хтось вважав би Чорта ваймака безвідповідальним і , можливо , мав би рацію , проте ніл розумів , що не все так просто . деякі стверджували , що ваймак Назбирує в команду проблемних юнаків та дівчат заради самопіару , інші бачили в ньому заблудлого ідеаліста .",0.48058252427184467
