
"у торговий центр ніл більше не повернувся, але незабаром лиси приєдналися до нього в машині. про телефон ніхто не згадував, і, хоча нікі раз у раз занепокоєно поглядав на ніла в дзеркало заднього виду, на зворотному шляху в кампус до нього ніхто не ліз. мовчання не могло тривати вічно, хоч би як нілу того не хотілося. вийшовши з душової наполовину одягненим для нічного тренування з кевіном, він виявив, що дея в роздягальні вже немає.","у торговий центр ніл більше не повернувся , але незабаром лиси приєдналися до нього в Автомобілі. . про Апарат ніхто не згадував , і , хоча нікі Разум у раз занепокоєно поглядав на Небо в дзеркало заднього роду , на зворотному шляху в кампус до нього ніхто не Край . Безмовність не могло Триливатися вічно , хоч би як нілу того не Забажалося . Вийшовши з душової наполовину Убраний для нічного Вправляння з кевіном , він виявив , що дея в роздягальні Раніше немає .",0.8492917847025495
"судячи з Розпорошених на лаві речей , вийти його Примусило щось непередбачене . Чорт чекав ніла , Засідаючи верхи на лаві ; перед ним Лежав той самий телефон . мимоволі подивившись на Телефон , ніл швидко Переклав погляд на обличчя міньярда . Чоловік більше не Усміхнувся .","судячи з розкиданих на лаві речей, вийти його змусило щось непередбачене. ендрю чекав ніла, сидячи верхи на лаві; перед ним лежав той самий телефон. мимоволі подивившись на мобільник, ніл швидко перевів погляд на обличчя міньярда. ендрю більше не посміхався.",0.7958904109589041
"він Пропускав дев'ятигодинну Пігулку , щоб до відходу до сну вийти зі Схвильованого стану , хоча при цьому Звичайно не спав до опівночі , Проваджаючи кевіна і єгиптянина на тренуванні . — це ж треба , скільки Труднощів у людини , — зітхнув Грунь . — Мобільний мені не потрібен . — цього сезону тобі він Належний як немає кому .","він пропускав дев'ятигодинну таблетку, щоб до відходу до сну вийти зі збудженого стану, хоча при цьому зазвичай не спав до опівночі, супроводжуючи кевіна і ніла на тренуванні. — це ж треба, скільки проблем у людини, — зітхнув ендрю. — телефон мені не потрібен. — цього сезону тобі він потрібен як нікому.",0.8134387351778656
"ендрю витяг з кишені свій телефон і поклав його поруч із мобільним телефоном ніла. він був чорного кольору, але тієї ж моделі. відкривши обидва телефони, ендрю натиснув якісь кнопки. за кілька секунд його мобільний задзвонив.","Чорт витяг з кишені свій Мобільний і поклав його Поблизу із мобільним Апарат ніла . він був чорного Відтінку , але тієї ж моделі . Розкривши обидва телефони , ендрю Натиснув якісь кнопки . за кілька Миттєвостей його мобільний задзвонив .",0.7405405405405405
"ніл очікував почути стандартний рингтон, але натомість зазвучала пісня. вибір ендрю здався йому дивним, але потім він прислухався до тексту: пісня була про втікачів. ніл перетнув роздягальню і сів на лаву віч-на-віч з ендрю, потім згріб його телефон і з силою натиснув клавішу відбою. — думаєш, ти смішний? ніфіга.","ніл очікував почути стандартний Мелодійний , але натомість зазвучала пісня . Відбір ендрю здався йому дивний , але потім він Прислухався до тексту : пісня була про Перебіжчиків . ніл перетнув Роздягальню і сів на лаву Лице - віч з Життя , потім Згорнув його телефон і з міццю натиснув Кнопку відбою . — думаєш , ти Кумедний ? ніфіга .",0.8462450592885375
"— та й ти , знаєш , теж . Накинув собі на шию Зашморг , а кінець Вірьовки віддав ріко , — озвався ендрю . — я добре пам'ятаю , як обіцяв подбати про твою Захищеність . Імена бодай одну причину , через яку тобі обов'язково треба Класти мені палки в колеса . — останні вісім років мені вдавалося вижити лише тому , що мене не могли знайти .","— та й ти, знаєш, теж. накинув собі на шию петлю, а кінець мотузки віддав ріко, — озвався ендрю. — я добре пам'ятаю, як обіцяв подбати про твою безпеку. назви бодай одну причину, через яку тобі обов'язково треба ставити мені палки в колеса. — останні вісім років мені вдавалося вижити лише тому, що мене не могли знайти.",0.8333333333333333
— це не причина. — ми знову граємо в чесність? — а що треба? — ендрю забрав у ніла телефон. — тоді ти перший.,— це не Підстава . — ми Знов граємо в Правдивість ? — а що треба ? — ендрю забрав у Дещо телефон . — тоді ти перший .,0.9657894736842105
"ніл почав пальцем обертати свій мобільний на лавці. брати його до рук він не хотів і не міг. — розумієш, більшість батьків купують дітям телефони, просто щоб бути із ними на зв'язку, а я носив із собою мобілу через тих людей, які працювали на батька. мої батьки хотіли бути впевнені, що встигнуть зв'язатися зі мною, якщо станеться найгірше.","ніл почав пальцем обертати свій Переносний на лавці . брати його до Долонь. він не хотів і не Вміг . — розумієш , Перевага батьків Закуповують дітям Телефони , просто щоб бути із ними на зв'язку , а я Нести із собою мобілу через тих людей , які працювали на батька . мої батьки бажали бути впевнені , що Зможуть зв'язатися зі мною , якщо станеться найгірше .",0.7845018450184502
"« просто про всяк випадок » , — луною повторив він слова нікі . — я не Викинув телефон , коли Збіг. . батьки загинули на моїх Зіницях , але я сподівався , що Помиливсь . я вірив : одного доби вони подзвонять мені й Мовлять , що їхня смерть була Постановкою .","«просто про всяк випадок», — луною повторив він слова нікі. — я не викинув телефон, коли втік. батьки загинули на моїх очах, але я сподівався, що помилився. я вірив: одного дня вони подзвонять мені й скажуть, що їхня смерть була інсценуванням.",0.49740932642487046
що мені можна Звернутися додому і що все Впорядкується . але єдиний: дзвінок був від того чоловіка — він вимагав Здійснити гроші . з того Віку я не маю телефону . та мені він і не потрібен .,що мені можна повернутися додому і що все налагодиться. але єдиний дзвінок був від того чоловіка — він вимагав повернути гроші. з того часу я не маю телефону. та мені він і не потрібен.,0.7278911564625851
"— нікі , Наставнику , на гарячу Риску із запобігання Самогубствам , та кому хочеш . — я згадав , чому мене від тебе верне . — дивно , що ти забув про це . — Здавалося , забув , а може й ні . — ніл підштовхнув телефон до Кошмару .","— нікі, тренеру, на гарячу лінію із запобігання самогубствам, та кому хочеш. — я згадав, чому мене від тебе верне. — дивно, що ти забув про це. — може, забув, а може й ні. — ніл підштовхнув телефон до ендрю.",0.09316770186335403
"— має бути інший вихід. — наприклад, іноді проявляти характер, — запропонував ендрю. — розумію, людині, у якої на рівні інстинктів закладено раптом-що-давати-драла, це нелегко, але ти хоча б спробуй, раптом сподобається. — заштовхати цей дебільний телефон тобі в горло — ось що мені сподобалося б.","— має бути інший вихід . — Приміром , іноді Виявляти характер , — запропонував ендрю . — Збагну , людині , у якої на Показу інстинктів Вкласти раптом - Віддати - драла , це нелегко , але ти хоча б Зітни. , раптом Вподобається . — Впхнути цей дебільний Апарат тобі в горло — ось що мені сподобалося б .",0.1810344827586207
"— оце уже цікавіше. — я прийшов сюди не для того, щоб розважати тебе. — але, як я та очікував, ти настільки талановитий, що справляєшся з кількома завданнями одночасно. питання, ніле: я схожий на мерця? — ендрю показав на своє обличчя, зробив паузу, чекаючи на відповідь, і, не почувши її, зовсім не здивувався.","— оце Вже цікавіше . — я прийшов Тут не для того , щоб розважати тебе . — але , як я та Сподівався , ти настільки Здібний , що справляєшся з кількома Завданнями одночасно . питання , Ніщо : я схожий на Тіло ? — ендрю З'явив на своє обличчя , Здійснив паузу , Ждучи на відповідь , і , не Почувши її , зовсім не здивувався .",0.2719665271966527
"він поманив ніла ближче, ніби хотів щось показати на маленькому дисплеї телефону. клацанням відкривши розкладачку, ендрю вдавив одну-єдину кнопку. спочатку було тихо, потім пролунав приглушений звук набору номера. телефон ніла ожив; текст пісні відрізнявся, але голос виконавця був тим самим, що й у рингтоні ендрю.","він поманив Нільця ближче , ніби хотів щось З'ясувати на маленькому дисплеї телефону . Клацанням відкривши Розкладну. , ендрю вдавив одну - єдину кнопку . спочатку було Спокійно , потім пролунав приглушений Голос набору числа . Сматфон ніла ожив ; текст пісні відрізнявся , але Звук виконавця був тим самим , що й у Мелодику ендрю .",0.24615384615384617
"Грала все та ж безглузда пісня , тільки інший куплет , проте слова Яранили так само Міцно , як і ті , що звучали з телефона міньярда . ніл мовчки дивився на Дисплей , не натискаючи на відбій . — тобі телефонують , — підказав ендрю . не відчуваючи Перстів , ніл Взяв телефон та Відхилив кришку .","грала все та ж безглузда пісня, тільки інший куплет, проте слова ранили так само сильно, як і ті, що звучали з мобільника міньярда. ніл мовчки дивився на екран, не натискаючи на відбій. — тобі дзвонять, — підказав ендрю. не відчуваючи пальців, ніл узяв телефон та відкинув кришку.",0.4419642857142857
"ковзнувши поглядом на ім'я ендрю, що висвітлилося на дисплеї, він натиснув на клавішу відповіді й підніс мобільний до вуха. — твої батьки мертві, у тебе купа проблем, і попереду нічого хорошого не світить, — повідомив ендрю. — для тебе це не новина. але від сьогодні й до наступного травня ти залишишся нілом джостеном, а я людиною, яка пообіцяла тебе захистити.","ковзнувши поглядом на Найменування ендрю , що висвітлилося на Екрані , він натиснув на клавішу Репліки й підніс Переносний до вуха . — твої Батьки мертві , у тебе купа проблем , і попереду нічого Добре́. не світить , — повідомив ендрю . — для тебе це не новина . але від сьогодні й до Прийдешнього травня ти залишишся нілом джостеном , а я Істотою , яка пообіцяла тебе Оборонити .",0.4305555555555556
"мені по барабану, коли ти скористаєшся телефоном —завтра, післязавтра чи взагалі ніколи. але ти залишиш його в себе, бо одного разу він може тобі знадобитися. — ендрю підчепив пальцем підборіддя ніла і підняв його голову, змусивши подивитися на очі. — і цього дня ти не втечеш.","мені по барабану , коли ти Вдасися телефоном — Назавтра , післязавтра чи взагалі Ніколи. . але ти залишиш його в себе , бо одного разу він може тобі знадобитися . — ендрю Зачепив пальцем підборіддя Нілу і підняв його Череп , змусивши подивитися на Зіниці . — і цього дня ти не вбиваєш .",0.11312217194570136
ти Пригадуєш мою обіцянку і подзвониш . ніл раптом ніби Згубив голос і зумів тільки Хитнути . ендрю прибрав палець з його підборіддя і закрив свій телефон . ніл тихим з клацанням Здійснив те саме .,ти згадаєш мою обіцянку і подзвониш. ніл раптом ніби втратив голос і зумів тільки кивнути. ендрю прибрав палець з його підборіддя і закрив свій телефон. ніл тихим з клацанням зробив те саме.,0.10126582278481013
"нескінченно довгу хвилину він свердлив мобільник поглядом, потім взяв його в руку і сховав у сумку. ендрю спостерігав за ним з-під напівприкритих повік. ніл уникав дивитися на міньярда, поки не впорається з емоціями, але вони відбивалися на його обличчі надто явно. ендрю вивчав ніла ще деякий час, потім зітхнув і відсунувся.","Безмежно довгу хвилину він просвердлив мобільник Зором , потім взяв його в руку і сховав у сумку . ендрю спостерігав за ним з-під напівприкритих повік . ніл уникав глядати на міньярда , доки не впорається з Почуттями , але вони відбивалися на його обличчі надто Звісно . Чорт вивчав Нілуса ще деякий час , потім Зітхнув і відсунувся .",0.2546816479400749
"— якщо ти перестав терпіти , став своє запитання , а то кевін Уже задовбався тебе чекати . ніл Намірявся запитати про кевіна , але телефони нагадали йому про ще Трохи . випитати істину про умову між кевіном та кінцем можна і в дея , а на це інше Запитання ніхто , крім ендрю , не відповість . — Чому тобі телефонували з Міліції окленда ?","— якщо ти перестав страждати, став своє запитання, а то кевін вже задовбався тебе чекати. ніл збирався запитати про кевіна, але телефони нагадали йому про ще дещо. випитати правду про умову між кевіном та ендрю можна і в дея, а на це інше питання ніхто, крім ендрю, не відповість. — навіщо тобі телефонували з поліції окленда?",0.22692307692307692
"— ух ти , одразу в Шию вчепився . може , ти не така вже й Дрантя , — з легким Здивуванням промовив ендрю . — служба опіки розпочала розслідування щодо одного з моїх прийомних батьків . кабан хіґґінс Відає , що я жив у тій сім'ї , і хоче , щоб я свідчив .","— ух ти, одразу в горлянку вчепився. може, ти не така вже й ганчірка, — з легким подивом промовив ендрю. — служба опіки розпочала розслідування щодо одного з моїх прийомних батьків. кабан хіґґінс знає, що я жив у тій сім'ї, і хоче, щоб я свідчив.",0.1881720430107527
"— але ж ти його послав . — річард спір — Нецікавий , але відносно Нешкідний тип . копачам не вдасться нічого на нього повісити . — точно ? якщо це просте непорозуміння , якось Надто бурхливо ти відреагував . — мені не подобається це слово .","— але ж ти його послав. — річард спір — нудний, але відносно нешкідливий тип. копам не вдасться нічого на нього повісити. — точно? якщо це просте непорозуміння, якось занадто бурхливо ти відреагував. — мені не подобається це слово.",0.3756906077348066
— бурхливо? — обережно спитав ніл. чим воно може не подобатися? — не тобі судити про чужі дивацтва. ендрю перекинув ногу через лаву і підвівся.,— Шалено ? — обережно Запитав ніл . чим воно Вміє не подобатися ? — не тобі судити про чужі Примхи . ендрю Перекинув ногу через Розжарину і підвівся .,0.7990990990990992
"здавалося, ніби за вікном настав гелловін — тільки на два місяці раніше, ніж треба.","не знімаючи руки з плеча ніла, він якось надто бадьоро звернувся до всієї команди: — слухайте, а ми взагалі виглядаємо набагато краще, ніж я очікував. у роздягальню зайшов ваймак.",0.07575757575757576
"з нагоди початку навчального року весь минулий тиждень університет пальметто ряснів помаранчевим та білим, а на вихідних хтось замінив білі прапорці та стрічки на чорні — кампус наче занурився у жалобу.",— заодно і подивимося. ваймак задоволено кивнув головою.,0.04142011834319527
"так собі данина поваги, подумав ніл джостен, хоча, найімовірніше, у ньому просто говорив цинізм.","бачачи, що ніл забарився, аарон пояснив:",0.02564102564102564
він не докоряв собі за черствість.,"піднявши очі, тренер помітив ніла, але його появу на заміну бойда не прокоментував. ніл теж промовчав і лише стиснув пальцями сітку своєї ключки.",0.14285714285714285
"у свої вісімнадцять ніл побачив стільки смертей, що пальців на руках не вистачить порахувати.","— а, ну, тут все просто. — ендрю впорався зі зборами, вжикнув блискавкою, закинув сумку на спину і піднявся на ноги перед носом у кевіна, майже змусивши того відступити.",0.14102564102564102
