
"проте, судячи з початку сезону, подібна трансформація цілком могла стати неминучою. йому потрібен час, щоб поміркувати над обома версіями загибелі сета, хоча, з іншого боку, кого хвилює, що він там думає? якщо елісон проведе паралелі та звинуватить його у смерті гордона, на будь-якому контакті з нею цього сезону можна ставити хрест.",— аарон більше не намагався йому писати.,0.014705882352941176
"ніл усвідомлював, що стосунки з елісон треба якось налагодити, тільки як? він зроду не володів талантом справляти гарне враження та схиляти до себе оточуючих, і навряд чи дівчина на зразок елісон стане першою в його списку досягнень. при погляді на елісон рейнольдс одразу виникало непорозуміле питання: яким чином її взагалі занесло в команду «лисів»? володіючи зовнішністю принцеси з обкладинки глянцевого журналу, на полі вона могла боротися з найкращими.","а нілу зовсім не хотілося опинитися далеко від «лисячої нори» з порожніми руками. — забери пальці, — попередив ваймак.",0.015706806282722512
"елісон відмовилася виправдовувати чиїсь очікування, а її прямота часом межувала з жорстокістю. бувши спадкоємицею багатомільярдної батьківської імперії, вона не збиралася терпіти ті рамки, які накладало розкішне життя.",я взагалі бачив його лише один раз.,0.0106951871657754
"елісон хотіла відвоювати право бути собою; виходячи на поле, хотіла довести, чого варта. а ще хотіла бути з сетом — всупереч його чварному характеру і грубої любові.",ден поклала руки на плечі ніла і серйозно поглянула йому у вічі.,0.022556390977443608
"ніл сподівався, що з цих трьох пунктів елісон навчиться обходитися першими двома. очевидно, ендрю відчув, як напружився ніл, — у машині вони сиділи пліч-о-пліч.",метт набрав повні груди повітря і зрештою зважився відімкнути замок.,0.0234375
"простеживши його поглядом, міньярд теж побачив автомобіль еббі. нікі тим часом знайшов місце для паркування.","ваймак жестом звелів йому замовкнути, але ендрю схопив тренера за зап'ястя і висмикнув слухавку.",0.054945054945054944
"— все-таки приїхала, — зауважив ендрю. нікі витяг ключ із замку запалювання.","— у фінал, кажеш, проб'ємося? — спитав він у метта.",0.03389830508474576
"— цікаво? хіба що тобі. — кому ж ще, — посміхнувся ендрю, вилазячи з машини.","двері в кабінет ваймака в коридорі відчинилися, але секундою пізніше задзвонив телефон.",0.05555555555555555
"аарон виходити не поспішав, тому ніл стрибнув на асфальт слідом за ендрю і застиг, тримаючись за ручку і дивлячись на автобус «лисів», що був припаркований неподалік. ендрю спостерігав за ним зі знущальною усмішкою.",я порвав цей листок і викинув у смітник.,0.03932584269662921
"ніл тягнув час, і обидва це знали. розлютившись, ніл зачинив дверцята авто і попрямував до огорожі.","— розмаж його, — коротко наказав він. нілу здалося, що він чекав цього моменту все життя. кевін, елісон та аарон поступилися місцем на полі запасним гравцям.",0.125
"ввів код на панелі — останні цифри телефонного номера еббі, — почув звуковий сигнал і штовхнув двері. ендрю пішов за ним, а за спиною у того, безперечно, йшов кевін, тому ніл навмисно не зменшував кроку.",запізнитеся — примушу бігти марафон.,0.00625
"приготувавшись до будь-якої можливої реакції елісон, він увійшов до кімнати відпочинку. він бачив елісон різною: шикарно одягненою красунею, з бездоганним макіяжем та зачіскою; звичайним дівчиськом, що розчервонілася і змокла після гри, але ще ніколи не бачив її такою, як зараз.","чи не почули, чи що?",0.004347826086956522
"платинові пасма елісон були ідеально укладені, одяг, як завжди, виглядав дорого і стильно. на перший погляд, нічого не змінилося, проте нілу вистачило частки секунди, аби зрозуміти: щось у ній надломилося.",— це не причина. — ми знову граємо в чесність? — а що треба? — ендрю забрав у ніла телефон. — тоді ти перший.,0.04790419161676647
"елісон сиділа, зчепивши пальці в замок і затиснувши їх між колінами. її плечі поникли, обличчя перетворилося на непроникну маску.","він був точною копією свого кровожерливого тата, від якого втік вісім років тому.",0.028037383177570093
"опустивши голову, вона дивилася в підлогу і не помічала появу п'ятьох товаришів по команді. ендрю рушив прямо до дивана, ніби її тут і не було.","— ну, прикиньте самі.",0.008771929824561403
"аарон і кевін, на відміну від нього, побачивши елісон завмерли на порозі. ніл відкрив рота, щоб вибачитися або хоча б запитати, як вона почувається, але слова застрягли в горлі.","не знаю, навіщо вона дала номер.",0.014084507042253521
"дивно, проте першим, хто знайшов у собі мужність підійти до елісон, став нікі. він обережно сів перед нею навпочіпки, наче боявся злякати, і зазирнув у вічі.","— не забирайся так глибоко, гаразд? інакше забудеш про нас. стій однією ногою в норі, а іншою — на поверхні, разом із нами.",0.04
"— привіт, — мовив він м'яко, начебто вони й не гиркалися на тренуваннях все літо. — чим тобі допомогти?",рот кевіна стиснувся в тонку напружену лінію.,0.03896103896103896
"запитання вона почула, але не відповіла, а лише сильніше стиснула губи, так, що ті побіліли. нікі не зрушив з місця, намагаючись, якщо вже не розговорити її, то принаймні висловити мовчазну підтримку.","а ще ніл не міг дочекатися, коли вийде на поле знову і вже по-справжньому перевірить, чи гідний першого дивізіону сам. він хотів зробити свій внесок у перетворення команди, хотів якнайшвидше відчути бездоганну синхронність роботи всіх гравців, нехай навіть це триватиме якусь мить. на той час, коли ваймак випустив його на поле, ніл вже знемагав від нетерпіння і спраги кинутися в бій. біля дверей вони з ден на удачу стукнулися ключками, проте звуку ніл не почув — все заглушував шалений стукіт серця, що віддавав у скронях.",0.043478260869565216
"пройшла ціла вічність, перш ніж елісон ворухнулася, проте на нікі вона навіть не подивилася. вона повільно підвела голову, і погляд її димчасто-сірих очей безпомилково знайшов ніла.","— це не я, це однорукий! — крикнув звідкись із глибини кімнати ендрю.",0.02
"він нерухомо і мовчки стояв на порозі, чекаючи на вирок, проте його не було. болісно тяглися секунди, а обличчя елісон не змінювалося.","ніл зупинився на порозі, оцінюючи зміни.",0.037037037037037035
"вона не була розгнівана — хоча ніл вважав би це правильним, — не була і занурена в скорботу — саме це він і очікував побачити. була у цій роздягальні.","нілу подобалося випереджати й обводити довкола пальця захист противника, подобалося відчувати викид адреналіну в кров після точного удару по воротах. він любив динаміку, тиск, тріумф перемоги. все інше його життя являло собою суцільний бардак, тому драйв та чіткі правила гри служили йому необхідною опорою.",0.07758620689655173
"так, вона дихала, але виглядала неживою, мов маріонетка, у якої перерізали ниточки. від тортури ніла позбавила поява інших лисів; йому довелося відійти осторонь, щоб його не вдарило дверима.","не схоже було, що хіґґінс просто скучив.",0.025806451612903226
"ден і рене відразу підійшли до крісла елісон і посідали на підлокітники по обидва боки від неї. даніель — з виглядом швидше лютим, ніж підбадьорливим, — обвила рукою плечі елісон і щось зашепотіла їй на вухо.","— іду, — відповіла та й незабаром з'явилася в роздягальні з двома графинами в руках. в одному була вода, в іншому – ізотонік. наповнивши стаканчики, еббі по черзі роздала їх лисам.",0.041916167664670656
"та слухала її, схиливши голову, а ніл нарешті струсив із себе заціпеніння. коли стало ясно, що дівчата візьмуть турботу про елісон на себе, нікі піднявся на ноги та відійшов.","нікі припаркував автомобіль у далекому кінці паркування для спортсменів, і всі четверо попрямували до «лисячої вежі».",0.04285714285714286
"інші члени команди теж розбрелися на свої місця. усі лиси з'явилися вчасно, тоді як ваймак та еббі незвично затримувалися.","сет помер у ніч із суботи на неділю, а в понеділок його кремували.",0.01
"у ніла майнув здогад, що тренер спізнюється навмисне. його відсутність дозволяла видихнути, трохи пом'якшити усвідомлення тяжкої реальності.","як тільки ендрю та нікі розігріються, переходимо до відпрацювання вправ. у нас… — ваймак не договорив: з коридору почувся дзвінок.",0.058823529411764705
"ваймак давав своїм підопічним кілька зайвих хвилин, щоб зустрітися з елісон та її горем, можливість подивитися на неї, перш ніж він знову перемкне їхню увагу на ексі. крім того, тепер було ясно, із чим доведеться зіткнутися сьогодні.","чи планує елісон поховати прах або збирається весь рік тримати урну у себе в кімнаті, ніл не знав та й не питав.",0.02631578947368421
"елісон повернулася, але виглядала так, ніби ось-ось розсиплеться. ніл сумнівався, що вона зможе грати.","вони обговорили своє повернення у форму, висловили обережну надію на успіх у другому таймі, ден і метт навіть посміялися з грубого зауваження, яке нападник «черепах» відпустив на адресу бойда. ніл обвів очима товаришів по команді, переймаючись їх натхненням, але його увага майже відразу ж зосередилась на ендрю. нілу і раніше доводилося бачити, як важко міньярд переносить пропуск таблеток, але тоді все було інакше.",0.1566265060240964
"а якщо не зможе, справі кінець. команда бельмонтського університету вважалася однією з найсильніших в окрузі.","— метт, — м'яко дорікнула його рене, потім подивилася на нікі.",0.021739130434782608
"не настільки титулована, як брекенріджці, але суперник майже такий же складний, особливо тепер, коли «лиси» втратили сета. якщо вони втратять і елісон, матч можна вважати програним ще до його початку.","— він має рацію, — втрутився ніл перш ніж кевін встиг відповісти.",0.018292682926829267
нарешті двері кабінету ваймака відчинилися. тренер увійшов до кімнати відпочинку та помахав елісон.,"гра від початку була жорсткою. ніл намагався дотримуватися поради кевіна, але необхідність стримувати сили дратувала. він не міг зрозуміти, як даніель та елісон не вмирають від нудьги на позиції півзахисників, всю гру займаючись передачею пасів.",0.03529411764705882
"— елісон, можеш іти в автобус. нікі принесе твої речі.","— ох, тренере, здається, я підхопив застуду.",0.024390243902439025
"нікі скорчив невдоволену гримасу, але у присутності рейнольдс сперечатися не став. елісон вислизнула з обіймів ден і, не озираючись, пішла. почекавши, доки вона зачинить за собою двері, нікі подав голос:","у нас із ним більше спільного, ніж ти думаєш. тобі ж тому зі мною некомфортно?",0.030120481927710843
"— хто взагалі придумав її сюди притягнути? не треба їй нікуди їхати. — ми надали їй вибір, — відповів ваймак.","те, що ендрю зрушив прийом таблетки, йому не допоможе: надто довго треба протриматися. міньярд чудово все розумів, проте його це ніби не турбувало.",0.024096385542168676
— вона сама захотіла прийти. — а я не давав би вибору.,"— метт... — ден замовкла і кинула погляд на порожнє місце біля стіни, де раніше стояв письмовий стіл сета, ніби не наважувалася вимовити наступну фразу вголос.",0.10256410256410256
"— нікі кинув стривожений погляд на двері. — залишив би вдома, а потім вибачився.","— як думаєш, чим це обернеться для нас цього сезону?",0.04838709677419355
"вона поки що не готова до гри. — нікі, де ж твоя віра в товаришів? — посміхнувся ендрю.","— бачиш це, ідіот? — він потряс у повітрі лівою рукою. на відстані шрами було не видно, проте ніл зрозумів, що має на увазі кевін. — травми — це не жарт, їх не можна приховувати.",0.078125
"— не хвилюйся, вона відіграє як треба. з його боку на підтримку ніхто не очікував.","— пусті балачки, — сухо промовив тренер.",0.046875
"на противагу сумнівам вражених лисів, ендрю широко посміхався. пояснити причини своєї впевненості він не завдав собі клопоту і лише показав великими пальцями на нападників, що стояли з обох боків від нього:",— але чогось запам'ятав.,0.011627906976744186
— краще б за цих двох недоумків хвилювалися. — про це я й хотів поговорити.,— я майже не збрехав.,0.017543859649122806
"— ваймак вийшов на середину кімнати й став спиною до телевізора. — ми з даніель весь тиждень сушили голову, що робити з лінією нападу.",кевін дей на передньому пасажирському сидінні помітив цей рух першим.,0.03773584905660377
"вам усім добре відомо, що третього нападника я поки що знайти не можу. кевіну вже доводилося грати два тайми поспіль, але це було до травми.",ендрю страдницьки помацав власного лоба.,0.017857142857142856
"у тебе такого досвіду нема. — він глянув на ніла і, коли той заперечливо похитав головою, кивнув.","— сьогоднішня гра буде ахуєнною! — ти, мабуть, хотів сказати хуйовою, — озвався той, застібаючи сумку.",0.05263157894736842
"— тобто сьогодні провести всю гру на полі ви не в змозі, але за тиждень ми вас до цього підготуємо — спочатку одного, потім іншого. а до того часу доведеться якось викручуватися.","він поставив напої на кавовий столик, а потім сів, підігнувши коліна, навпроти ден та метта.",0.04964539007092199
"— тренер поглянув на ден і рене, які так і продовжували сидіти на підлокітниках крісла елісон. — рішення не наймайстерніше, але це найкраще, що ми змогли придумати за такий короткий час, тому слухайте уважно.",— спершу треба випити.,0.005988023952095809
"ваймак узяв із телевізійної тумби свою теку-планшет,перегорнув кілька сторінок і зачитав: — сьогоднішній стартовий склад на перший тайм: ендрю, метт, нікі, елісон, кевін, ніл. заміни: аарон виходить замість нікі, ден — замість кевіна, рене — замість елісон.","кхе-кхе. краще піду, доки не заразив усю вашу команду.",0.014705882352941176
— він прибрав руку з планшета і звів очі. — усі зрозуміли? повторювати не буду.,"— даси пораду? — звернувся він до кевіна. на відповідь ніл не розраховував, але кевін все ж таки повернув голову в його бік.",0.1
"— тренер, ви зараз пожартували? — злякався нікі. — рене взагалі-то воротар.","блядський марафон, ніле! такий хлопець, як я, на такій дистанції здохне. будь ласкавий, зробиш послугу і не сперечайся. — та що не так з моїм одягом? — відмотаємо час назад в той момент, коли я просив не сперечатися, гаразд? я добре його запам'ятав, адже лише п'ять секунд минуло.",0.07142857142857142
"— у нападі може грати тільки ден, — втрутилася рене, — а сильно розраховувати на елісон поки що не варто. ми з тренером вже обговорили це у вівторок, тож я встигла трохи підігнати екіпірування.","ендрю відшліфував цю схему до майстерного рівня — минулого тижня навіть ніл не помітив, коли його почало ламати. однак тоді треба було витримати один тайм, а тепер ендрю належало перебувати на полі від початку до кінця.",0.07894736842105263
"ну так, я не грала в захисті зі школи, але обіцяю, що постараюся. — не зрозумій мене неправильно, але я хвилююся не за тебе, — сказав нікі.","— поняття не маю, — байдуже сказав той.",0.009615384615384616
"— якщо ти гратимеш за плеймейкера, хто стане на ворота у другому таймі? ваймак глянув на ендрю.","— стривай, — не зрозуміла ден. — що означає «ніяк»?",0.013333333333333334
